key,city,country,latitude,longitude,comment,annotation
argamesilla,Argamasilla de Alba,España,391.292,-308.889,,Nota de alcance sobre el lugar (no puede quedar en blanco)
aragon,Aragón,España,41.649.693,-887.712,,Nota de alcance sobre el lugar (no puede quedar en blanco)
zaragoza,Zaragoza,España,41.649.693,-887.712,,Nota de alcance sobre el lugar (no puede quedar en blanco)
villambroz,Villambroz,España,42.411.289.404.578.800,4.8232673028411455,,Pueblo del que origina esta familia
valladolid,Valladolid,España,41.65663752134355,-4.728312841704544,,Ciudad cercana a Villambroz.
pensier,Pensier,Suiza,46.86555638991404,7.126607619202089,,Lugar donde fue Argmiro a estudiar.
palencia,Palencia,España,42.007740489203705,-4.528012460080141,,Ciudad cercana a Villambroz.
mungia,Mungia,España,43.3546513924835,-2.8466412881588186,,Ciudad a la que emigraron Resti y Orencio.
francia,Francia,Francia,46.660578331534836,2.672445785993602,,País al que enviaron a Indalencio con el ejército.